{
  "version": 1,
  "studentId": "timofey",
  "updated": "2026-10-07",
  "levels": {
    "ege2027_t17_analysis": {
      "level": 2,
      "sourcePath": "site/competence-config.js",
      "sourceKind": "teacher-seed",
      "basis": "Repository-authored teacher-seed mastery value."
    },
    "ege2027_t17_constraints": {
      "level": 3,
      "sourcePath": "site/competence-config.js",
      "sourceKind": "teacher-seed",
      "basis": "Repository-authored teacher-seed mastery value."
    },
    "ege2027_t17_interpretation": {
      "level": 3,
      "sourcePath": "site/competence-config.js",
      "sourceKind": "teacher-seed",
      "basis": "Repository-authored teacher-seed mastery value."
    },
    "ege2027_t17_optimization": {
      "level": 2,
      "sourcePath": "site/competence-config.js",
      "sourceKind": "teacher-seed",
      "basis": "Repository-authored teacher-seed mastery value."
    },
    "ege2027_t17_relations": {
      "level": 3,
      "sourcePath": "site/competence-config.js",
      "sourceKind": "teacher-seed",
      "basis": "Repository-authored teacher-seed mastery value."
    },
    "ege2027_t17_variables": {
      "level": 3,
      "sourcePath": "site/competence-config.js",
      "sourceKind": "teacher-seed",
      "basis": "Repository-authored teacher-seed mastery value."
    },
    "t10_line": {
      "level": 3,
      "sourcePath": "site/competence-config.js",
      "sourceKind": "teacher-seed",
      "basis": "Repository-authored teacher-seed mastery value."
    },
    "t10_percent": {
      "level": 2,
      "sourcePath": "site/competence-config.js",
      "sourceKind": "teacher-seed",
      "basis": "Repository-authored teacher-seed mastery value."
    },
    "t10_pipes": {
      "level": 2,
      "sourcePath": "site/competence-config.js",
      "sourceKind": "teacher-seed",
      "basis": "Repository-authored teacher-seed mastery value."
    },
    "t10_validation": {
      "level": 3,
      "sourcePath": "site/competence-config.js",
      "sourceKind": "teacher-seed",
      "basis": "Repository-authored teacher-seed mastery value."
    },
    "t10_work": {
      "level": 3,
      "sourcePath": "site/competence-config.js",
      "sourceKind": "teacher-seed",
      "basis": "Repository-authored teacher-seed mastery value."
    },
    "t11_domain": {
      "level": 2,
      "sourcePath": "site/competence-config.js",
      "sourceKind": "teacher-seed",
      "basis": "Repository-authored teacher-seed mastery value."
    },
    "t11_hyperbola": {
      "level": 3,
      "sourcePath": "site/competence-config.js",
      "sourceKind": "teacher-seed",
      "basis": "Repository-authored teacher-seed mastery value."
    },
    "t11_intersections": {
      "level": 3,
      "sourcePath": "site/competence-config.js",
      "sourceKind": "teacher-seed",
      "basis": "Repository-authored teacher-seed mastery value."
    },
    "t11_linear": {
      "level": 3,
      "sourcePath": "site/competence-config.js",
      "sourceKind": "teacher-seed",
      "basis": "Repository-authored teacher-seed mastery value."
    },
    "t11_parabola": {
      "level": 3,
      "sourcePath": "site/competence-config.js",
      "sourceKind": "teacher-seed",
      "basis": "Repository-authored teacher-seed mastery value."
    },
    "t11_roots": {
      "level": 2,
      "sourcePath": "site/competence-config.js",
      "sourceKind": "teacher-seed",
      "basis": "Repository-authored teacher-seed mastery value."
    },
    "t11_transformations": {
      "level": 2,
      "sourcePath": "site/competence-config.js",
      "sourceKind": "teacher-seed",
      "basis": "Repository-authored teacher-seed mastery value."
    },
    "t15_log_basic": {
      "level": 2,
      "sourcePath": "site/competence-config.js",
      "sourceKind": "teacher-seed",
      "basis": "Repository-authored teacher-seed mastery value."
    },
    "t15_log_rational": {
      "level": 2,
      "sourcePath": "site/competence-config.js",
      "sourceKind": "teacher-seed",
      "basis": "Repository-authored teacher-seed mastery value."
    },
    "t16_annuity": {
      "level": 2,
      "sourcePath": "site/competence-config.js",
      "sourceKind": "teacher-seed",
      "basis": "Repository-authored teacher-seed mastery value."
    },
    "t16_credits": {
      "level": 2,
      "sourcePath": "site/competence-config.js",
      "sourceKind": "teacher-seed",
      "basis": "Repository-authored teacher-seed mastery value."
    },
    "t16_debt_table": {
      "level": 3,
      "sourcePath": "site/07.10.26.html#credit-ledger",
      "sourceKind": "teacher-mastery",
      "basis": "07.10.26 Тимофей самостоятельно заполнил кредитную таблицу по заданной структуре; преподаватель подтвердил корректность результата."
    },
    "t16_deposits": {
      "level": 3,
      "sourcePath": "site/competence-config.js",
      "sourceKind": "teacher-seed",
      "basis": "Repository-authored teacher-seed mastery value."
    },
    "t16_equal_reduction": {
      "level": 2,
      "sourcePath": "site/competence-config.js",
      "sourceKind": "teacher-seed",
      "basis": "Repository-authored teacher-seed mastery value."
    },
    "t16_model_equation": {
      "level": 2,
      "sourcePath": "site/competence-config.js",
      "sourceKind": "teacher-seed",
      "basis": "Repository-authored teacher-seed mastery value."
    },
    "t6_exponential": {
      "level": 2,
      "sourcePath": "site/competence-config.js",
      "sourceKind": "teacher-seed",
      "basis": "Repository-authored teacher-seed mastery value."
    },
    "t6_factor": {
      "level": 2,
      "sourcePath": "site/competence-config.js",
      "sourceKind": "teacher-seed",
      "basis": "Repository-authored teacher-seed mastery value."
    },
    "t6_irrational": {
      "level": 3,
      "sourcePath": "site/competence-config.js",
      "sourceKind": "teacher-seed",
      "basis": "Repository-authored teacher-seed mastery value."
    },
    "t6_linear_quad": {
      "level": 2,
      "sourcePath": "site/competence-config.js",
      "sourceKind": "teacher-seed",
      "basis": "Repository-authored teacher-seed mastery value."
    },
    "t6_logarithmic": {
      "level": 2,
      "sourcePath": "site/competence-config.js",
      "sourceKind": "teacher-seed",
      "basis": "Repository-authored teacher-seed mastery value."
    },
    "t6_trig_special": {
      "level": 3,
      "sourcePath": "site/competence-config.js",
      "sourceKind": "teacher-seed",
      "basis": "Repository-authored teacher-seed mastery value."
    },
    "t6_trigonometric": {
      "level": 3,
      "sourcePath": "site/competence-config.js",
      "sourceKind": "teacher-seed",
      "basis": "Repository-authored teacher-seed mastery value."
    },
    "t7_log_var": {
      "level": 2,
      "sourcePath": "site/competence-config.js",
      "sourceKind": "teacher-seed",
      "basis": "Repository-authored teacher-seed mastery value."
    },
    "t7_power_actions": {
      "level": 2,
      "sourcePath": "site/competence-config.js",
      "sourceKind": "teacher-seed",
      "basis": "Repository-authored teacher-seed mastery value."
    },
    "t8_boundary_extreme": {
      "level": 2,
      "sourcePath": "site/competence-config.js",
      "sourceKind": "teacher-seed",
      "basis": "Repository-authored teacher-seed mastery value."
    },
    "t8_derivative_rules": {
      "level": 3,
      "sourcePath": "site/competence-config.js",
      "sourceKind": "teacher-seed",
      "basis": "Repository-authored teacher-seed mastery value."
    },
    "t8_elementary_derivatives": {
      "level": 2,
      "sourcePath": "site/competence-config.js",
      "sourceKind": "teacher-seed",
      "basis": "Repository-authored teacher-seed mastery value."
    },
    "t8_extrema": {
      "level": 3,
      "sourcePath": "site/competence-config.js",
      "sourceKind": "teacher-seed",
      "basis": "Repository-authored teacher-seed mastery value."
    },
    "t8_internal_extreme": {
      "level": 3,
      "sourcePath": "site/competence-config.js",
      "sourceKind": "teacher-seed",
      "basis": "Repository-authored teacher-seed mastery value."
    },
    "t8_monotonicity": {
      "level": 3,
      "sourcePath": "site/competence-config.js",
      "sourceKind": "teacher-seed",
      "basis": "Repository-authored teacher-seed mastery value."
    },
    "t9_formula_transform": {
      "level": 3,
      "sourcePath": "site/competence-config.js",
      "sourceKind": "teacher-seed",
      "basis": "Repository-authored teacher-seed mastery value."
    },
    "t9_linear": {
      "level": 2,
      "sourcePath": "site/competence-config.js",
      "sourceKind": "teacher-seed",
      "basis": "Repository-authored teacher-seed mastery value."
    },
    "t9_other": {
      "level": 2,
      "sourcePath": "site/competence-config.js",
      "sourceKind": "teacher-seed",
      "basis": "Repository-authored teacher-seed mastery value."
    },
    "t9_power": {
      "level": 2,
      "sourcePath": "site/competence-config.js",
      "sourceKind": "teacher-seed",
      "basis": "Repository-authored teacher-seed mastery value."
    },
    "t9_rational": {
      "level": 3,
      "sourcePath": "site/competence-config.js",
      "sourceKind": "teacher-seed",
      "basis": "Repository-authored teacher-seed mastery value."
    },
    "t9_units": {
      "level": 3,
      "sourcePath": "site/competence-config.js",
      "sourceKind": "teacher-seed",
      "basis": "Repository-authored teacher-seed mastery value."
    },
    "t16_payment_sum": {
      "level": 2,
      "sourcePath": "site/07.10.26.html#payment-constraints",
      "sourceKind": "teacher-mastery",
      "basis": "07.10.26 Тимофей самостоятельно определил, что для условия об общей сумме выплат нужно сложить значения графы платежей; полный самостоятельный цикл решения ещё закрепляется."
    }
  }
}
